{"$schema":"https://json-schema.org/draft/2020-12/schema","$id":"dashboard-anomaly-alert-v1","type":"object","additionalProperties":false,"required":["alert_id","event_id","asset_id","observed_at","severity","status","headline","product_result_id","created_at"],"properties":{"alert_id":{"type":"string","minLength":1},"event_id":{"type":"string","minLength":1},"asset_id":{"type":"string","minLength":1},"observed_at":{"type":"string","format":"date-time"},"severity":{"enum":["attention","warning","critical"]},"status":{"enum":["open","acknowledged","closed"]},"headline":{"type":"string","minLength":1},"product_result_id":{"type":"string","minLength":1},"evidence_id":{"type":["string","null"]},"report_id":{"type":["string","null"]},"created_at":{"type":"string","format":"date-time"}}}
