{"alert_id":"alert-demo-001","event_id":"prediction-demo-001","asset_id":"CNC-001","observed_at":"2026-09-02T00:00:00Z","severity":"warning","status":"open","headline":"CNC-001 이상 징후 감지","product_result_id":"prediction-demo-001","evidence_id":null,"report_id":null,"created_at":"2026-09-02T00:00:05Z"}
